22482,TEMPTATIONS HEARTY BEEF FLAVOR,5849672302, 60 , 55 , 5 ,92%,$90 ,$83 
102841,TEMPTATIONS CREAMY DAIRY FLAV,5849672303, 120 , 107 , 13 ,89%,$180 ,$161 
22483,TEMPTATIONS SAVORY SALMON FLAV,5849672304, 144 , 128 , 16 ,89%,$216 ,$192 
298906,PL BACON & CHEESE STRIPS,7015516619, 42 , 39 , 3 ,93%,$135 ,$126 
299907,PL GOURMET CUTS BEEF & RICE,7015516621, 106 , 108 ,(2),102%,$529 ,$540 
299908,PL GOURMET CUTS BEEF & CHS,7015516622, 179 , 173 , 6 ,97%,$893 ,$867 
299909,PL CHEESE FLAVOR WRAPS,7015516623, 48 , 49 ,(1),102%,$240 ,$245 
298769,MEATBALL DELIGHTS LIVER FLAVOR,7015516625, 38 , 41 ,(3),108%,$122 ,$132 
363231,PET LIFE BACON CHSE STRIPS PPK,7015517065, 8 , 8 , 0 ,100%,$80 ,$80 
333094,TIDY CATS 24/7 PERFORMNCE 35LB,7023001669, 111 , 111 , 0 ,100%,"$1,625 ","$1,634 "
549968,PURINA TIDY CATS 24/7 PERF,7023010734, 202 , 192 , 10 ,95%,"$1,309 ","$1,242 "
949248,TIDY CATS CONVENT IOC,7023010760, 184 , 182 , 2 ,99%,$550 ,$540 
716688,TIDY CATS SCOOP IMMEDIATE ODOR,7023010785, 72 , 72 , 0 ,100%,"$1,054 ","$1,058 "
608810,TIDY CATS SCOOP CONTINUOUS ODO,7023011614, 42 , 41 , 1 ,98%,$336 ,$329 
170394,TIDY CATS 24/7 JUG LITTER PRFM,7023011620, 392 , 381 , 11 ,97%,"$3,442 ","$3,352 "
843748,TIDY CATS SCOOP IMMEDIATE ODOR,7023011716, 51 , 54 ,(3),106%,$407 ,$433 
502765,TIDY CATS SCOOP PERF SCOOPING,7023011720, 400 , 383 , 17 ,96%,"$3,512 ","$3,385 "
182048,TIDY CATS GLADE,7023015345, 282 , 280 , 2 ,99%,"$2,476 ","$2,463 "
683837,TIDY CATS LITTER W/ GLADE 35LB,7023015348, 55 , 56 ,(1),102%,$805 ,$822 
266762,TIDYCAT LIGHTWEIGHT LITTER,7023015366, 120 , 118 , 2 ,98%,"$1,498 ","$1,476 "
16664,TIDY CATS LIGHTWEIGHT LITTER,7023015367, 35 , 34 , 1 ,97%,$719 ,$700 
73211,TIDY CATS CONVENT WITH GLADE,7023016516, 143 , 136 , 7 ,95%,$714 ,$674 
333332,TIDY CATS LT WGHT GLADE LITTER,7023016761, 242 , 240 , 2 ,99%,"$3,020 ","$2,997 "
333350,TIDY CATS 4-IN-1 STRNGTH 20 LB,7023016766, 200 , 193 , 7 ,97%,"$1,756 ","$1,698 "
704969,TIDY CATS FREE & CLN 20LB,7023016853, 168 , 177 ,(9),105%,"$1,475 ","$1,552 "
359235,RRN INDOOR COMPLETE DRY CAT FD,7119000360, 80 , 82 ,(2),103%,$515 ,$532 
768835,RRN INDOOR COMPLETE CAT FOOD,7119000361, 51 , 51 , 0 ,100%,$583 ,$584 
92046,RR NUTRISH - CHICKEN,7119000600, 190 , 187 , 3 ,98%,"$3,121 ","$3,072 "
835121,RRN CHKN & VEG DOG FD,7119000601, 144 , 145 ,(1),101%,"$1,146 ","$1,155 "
110275,RR NUTRISH - BEEF,7119000602, 193 , 188 , 5 ,97%,"$3,151 ","$3,076 "
448669,RRN BEEF & BRWN RICE DOG FD,7119000603, 174 , 169 , 5 ,97%,"$1,385 ","$1,343 "
272380,RACHAEL RAY NUTRISH BEEF,7119000633, 93 , 92 , 1 ,99%,"$2,901 ","$2,878 "
183027,RR SOUP BONES - BEEF,7119000668, 296 , 289 , 7 ,98%,$864 ,$845 
184210,RR SOUP BONES - CHICKEN,7119000670, 272 , 262 , 10 ,96%,$794 ,$766 
175106,RR DELISH - SAVORY LAMB STEW,7119000671, 104 , 110 ,(6),106%,$196 ,$207 
175416,RR DELISH - HEARTY BEEF 8OZ,7119000672, 64 , 89 ,(25),139%,$120 ,$168 
176006,RR DELISH - CHICKEN MUTTBALLS,7119000673, 104 , 109 ,(5),105%,$196 ,$205 
659478,RRN ZERO GRAIN TURKEY & POTATO,7119000684, 123 , 114 , 9 ,93%,"$1,296 ","$1,201 "
26925,RR NUTRISH WET CAT CHICKEN,7119000702, 72 , 55 , 17 ,76%,$68 ,$52 
270862,RR ZEROGRAIN DOG SALMON SWTPOT,7119000714, 40 , 40 , 0 ,100%,$422 ,$422 
177736,RR NUTRISH CHICKEN LOVERS VP,7119000777, 20 , 19 , 1 ,95%,$198 ,$189 
24842,RR NUTRISH DOG VARIETY PACK,7119000786, 66 , 68 ,(2),103%,$722 ,$745 
485750,RRN ZERO GRN CHKN & POT CAT FD,7119000813, 28 , 28 , 0 ,100%,$251 ,$253 
392380,RRN ZG CHKN & SWT POT DOG FD,7119000832, 55 , 54 , 1 ,98%,"$1,264 ","$1,242 "
330873,EVOLVE DBN SALMON RICE SWT POT,7365700864, 56 , 53 , 3 ,95%,$279 ,$262 
107694,EVOLVE DBN SALMON RICE SWT POT,7365700865, 18 , 14 , 4 ,78%,$384 ,$299 
929584,EVOLVE LIVER RECIPE,7365700937, 15 , 11 , 4 ,73%,$15 ,$11 
122151,EVOLVE ADLT CHKN MAIN DOG FOOD,7365738032, 44 , 42 , 2 ,95%,$730 ,$696 
247921,EVOLVE GF SALMON &SWEET POTATO,7365739015, 33 , 26 , 7 ,79%,$758 ,$597 
344081,EVOLVE GRN FREE CHKN PEA VEG,7365739044, 20 , 17 , 3 ,85%,$135 ,$115 
299478,ADVANCE 14CT TRAINING PADS,7648418814, 132 , 130 , 2 ,98%,$659 ,$649 
284414,ADVANCE 30CT TRAINING PADS,7648418830, 60 , 59 , 1 ,98%,$479 ,$472 
758631,9LIVES MEATY PATE SUPER SUPPER,7910000286, 72 , 78 ,(6),108%,$103 ,$112 
261972,9LIVES HEARTY CUTS W/ REAL CHI,7910000300, 36 , 39 ,(3),108%,$51 ,$56 
887008,9LVS MTY PTE SINGLES CHKN TUNA,7910000324, 24 , 37 ,(13),154%,$10 ,$16 
759019,9LIVES HEARTY CUTS W/ CHICKEN,7910000356, 24 , 19 , 5 ,79%,$34 ,$27 
758953,9LIVES MEATY PATE W/ CHICKEN &,7910000366, 42 , 40 , 2 ,95%,$60 ,$57 
735665,9LVS MTYPTE SINGLES SEAFD PLTR,7910000402, 0 , 14 ,(14),N/A,$0 ,$6 
220849,9 LIVES MEATY FAVORITES 36/5.5,7910012283, 14 , 14 , 0 ,100%,$172 ,$172 
27026,PUP-PERONI LEAN BEEF,7910044895, 72 , 70 , 2 ,97%,$663 ,$646 
90376,MEOW MIX SEAFOOD VP,7910045512, 32 , 30 , 2 ,94%,$353 ,$331 
125712,CCO BEEF FLAVOR,7910050154, 114 , 108 , 6 ,95%,$420 ,$398 
125696,CCO BACON FLAVOR,7910050155, 72 , 72 , 0 ,100%,$265 ,$266 
479500,MILK BONE MINI FLAV SNKS,7910050856, 318 , 324 ,(6),102%,$941 ,$961 
214573,PUPPERONI BEEF DOG SNKS 5.6OZ,7910051021, 176 , 167 , 9 ,95%,$461 ,$438 
125727,CCO CHICKEN FLVR,7910051147, 228 , 238 ,(10),104%,$219 ,$229 
221967,9 LIVES HEARTY CUTS POULTRY &,7910051152, 13 , 13 , 0 ,100%,$108 ,$108 
263906,CANINE CARRY OUTS BEEF FLAVOR,7910051254, 360 , 360 , 0 ,100%,$346 ,$346 
729888,MILK BONE MED BISCUITS,7910051352, 522 , 535 ,(13),102%,"$1,295 ","$1,330 "
54104,KNB BEEFY BITS,7910051445, 19 , 17 , 2 ,89%,$199 ,$178 
53812,KNB ORIGINAL,7910051446, 0 , 1 ,(1),N/A,$0 ,$11 
53939,KNB SMALL BREED,7910051447, 1 , 5 ,(4),500%,$10 ,$54 
250873,CANINE CARRY OUTS BACON SNACKS,7910051786, 300 , 299 , 1 ,100%,$288 ,$283 
178896,KIBBLES N BITS ORIGINAL FLAVOR,7910051849, 80 , 0 , 80 ,0%,$390 ,$0 
178802,KIBBLES N BITS SMALL BREED,7910051852, 76 , 0 , 76 ,0%,$402 ,$0 
136965,PUPPERONI TRAINING TREATS,7910052089, 80 , 78 , 2 ,98%,$210 ,$204 
73480,9LIVES DAILY ESS DRY CAT FOOD,7910052195, 0 , 1 ,(1),N/A,$0 ,$9 
169006,GRAVY TRAIN BEEFY CLASSIC,7910052703, 0 , 1 ,(1),N/A,$0 ,$8 
130790,PUPPERONI STEAK GRILL PR FLVR,7910052837, 92 , 91 , 1 ,99%,$853 ,$845 
45209,CCO CHEW BONES BEEF SMALL,7910052870, 204 , 214 ,(10),105%,$192 ,$201 
321522,PUPPERONI FILET & BACON,7910053301, 72 , 76 ,(4),106%,$189 ,$199 
340834,9LIVES SEAFOOD PLTRY VRTY,7910053377, 42 , 41 , 1 ,98%,$349 ,$341 
148580,PUP-PERONI BEEF,7910058371, 60 , 57 , 3 ,95%,$553 ,$526 
623557,MKB BRSH CHEWS MINI BONES,7910078555, 110 , 115 ,(5),105%,$383 ,$401 
357267,9LIVES GRAVY LOVERS VPK,7910083050, 36 , 34 , 2 ,94%,$152 ,$143 
981796,PP ORIGINAL BEEF FLAVOR,7910083052, 40 , 40 , 0 ,100%,$590 ,$590 
357287,9LIVES PATE FAVORITES VPK,7910083102, 43 , 42 , 1 ,98%,$181 ,$177 
627140,KNB BCN STK DRY DOG 16LB,7910085174, 82 , 4 , 78 ,5%,$859 ,$43 
433043,MKB BC FRESH LARGE DOGS,7910088252, 80 , 81 ,(1),101%,$719 ,$728 
437597,MILKBONE SMALLL BISCUIT,7910090202, 456 , 455 , 1 ,100%,"$1,350 ","$1,349 "
357292,MLKBN LARGE BISCUIT,7910090244, 190 , 186 , 4 ,98%,"$1,332 ","$1,309 "
462900,MLKBN MARO SNACKS JAR,7910092327, 96 , 98 ,(2),102%,$848 ,$867 
856459,MILOS KTCHN SMPLY CHKN JKY,7910099269, 25 , 25 , 0 ,100%,$250 ,$250 
880699,PUPPERONI MINIS BEEF 5.6OZ,7910099376, 96 , 92 , 4 ,96%,$252 ,$242 
884041,NUTRO CRUNCHY TREATS BERRY,7910511085, 60 , 62 ,(2),103%,$248 ,$257 
621936,NUTRO CRUNCHY TREATS CHCKN CRT,7910511087, 60 , 60 , 0 ,100%,$248 ,$249 
937489,NUTRO CRUNCHY TREATS PEANT BTR,7910511088, 72 , 70 , 2 ,97%,$298 ,$290 
421985,NUTRO SMALL BITES LAMB,7910511623, 61 , 59 , 2 ,97%,"$1,781 ","$1,708 "
525455,NUTRO WE SML BT ADLT LM AND RC,7910511624, 26 , 18 , 8 ,69%,$285 ,$197 
782063,NUTRO ADULT LAMB AND RICE,7910511631, 46 , 47 ,(1),102%,"$1,340 ","$1,369 "
456737,NUTRO WE ADLT LB AND RC,7910511632, 41 , 39 , 2 ,95%,$613 ,$579 
412581,NUTRO LARGE BRD LAMB AND RICE,7910511637, 31 , 32 ,(1),103%,"$1,517 ","$1,568 "
745999,NUTRO ADULT CHICKEN,7910511646, 114 , 113 , 1 ,99%,"$1,705 ","$1,692 "
938550,NUTRO ADULT CHICKEN,7910511647, 103 , 102 , 1 ,99%,"$3,011 ","$2,992 "
717671,NUTRO PUPPY CHICKEN,7910511648, 34 , 35 ,(1),103%,$992 ,"$1,023 "
869559,NUTRO ADULT CHICKEN,7910511662, 66 , 63 , 3 ,95%,"$3,230 ","$3,088 "
993553,NUTRO SENIOR CHICKEN,7910511663, 30 , 28 , 2 ,93%,$874 ,$816 
744705,NUTRO SMALL BREED ADULT CHCKN,7910511667, 50 , 44 , 6 ,88%,"$1,461 ","$1,287 "
811982,NUTRO PUPPY CHICKEN,7910511670, 36 , 34 , 2 ,94%,$539 ,$509 
648271,NUTRO ADULT SALMON,7910511744, 28 , 30 ,(2),107%,$285 ,$305 
485022,NUTRO INDOOR ADULT CHICKEN,7910511745, 20 , 18 , 2 ,90%,$204 ,$183 
685415,NUTRO INDOOR SENIOR CHICKEN,7910511747, 20 , 19 , 1 ,95%,$204 ,$195 
545484,NUTRO CAT INDOOR ADULT FISH,7910511759, 16 , 16 , 0 ,100%,$303 ,$303 
788341,NUTRO PETITE TURKEY AND VEGE,7910511778, 120 , 124 ,(4),103%,$180 ,$155 
734750,NUTRO PETITE PUPPY CHICKN RICE,7910511779, 144 , 153 ,(9),106%,$180 ,$192 
970648,NUTRO PETITE LAMB AND GARDEN,7910511780, 96 , 82 , 14 ,85%,$120 ,$103 
523420,NUTRO PETITE CHICKEN,7910511781, 120 , 105 , 15 ,88%,$150 ,$132 
941174,NUTRO PETITE BEEF AND POTATO,7910511783, 216 , 217 ,(1),100%,$270 ,$271 
670933,NUTRO DRY CAT WT MGT ADT CHX,7910511928, 12 , 9 , 3 ,75%,$246 ,$184 
673083,NUTRO SMALL BREED CHICKEN,7910512217, 147 , 146 , 1 ,99%,"$2,199 ","$2,185 "
556112,NUTRO PETITE CHCKN TURKEY 12PK,7910512536, 102 , 102 , 0 ,100%,"$1,524 ","$1,525 "
909191,NUTRO PETITE BEEF LAMB 12PK,7910512537, 58 , 58 , 0 ,100%,$867 ,$867 
924263,NUTRO PETITE 4 FLAVOR 24PK,7910512538, 17 , 14 , 3 ,82%,$527 ,$434 
435091,NUTRO DRY CAT HRBL ADLT CHK RC,7910512877, 6 , 5 , 1 ,83%,$78 ,$65 
926713,NUTRO DRY CAT ADLT CHIK BRN,7910512878, 45 , 39 , 6 ,87%,$585 ,$508 
333037,SCOOP AWAY MULTI CAT SCNTD LIT,9668902014, 44 , 44 , 0 ,100%,$477 ,$477 
356050,SC AWAY EX STRN SCNT CLUMP LIT,9668902063, 62 , 59 , 3 ,95%,$805 ,$767 
241671,SC AWAY MULTI CAT SCNTD LITTER,9668920016, 24 , 26 ,(2),108%,$173 ,$188 
126474,WORLDS BEST - CLUMPING,32259100090, 105 , 104 , 1 ,99%,$839 ,$831 
127949,WORLDS BEST - MULTI CAT,32259100625, 123 , 120 , 3 ,98%,"$1,043 ","$1,020 "
723522,GREENIES DOG DNTL CHW LGE,64286304110, 30 , 33 ,(3),110%,$449 ,$465 
720449,GREENIES DOG DNTL CHW PTE,64286304124, 90 , 95 ,(5),106%,"$1,348 ","$1,424 "
404075,GREENIES DOG DNTL CHW PTE 6OZ,64286310292, 48 , 37 , 11 ,77%,$407 ,$314 
436866,GREENIES DOG DNTL CHW REG 6OZ,64286310293, 42 , 41 , 1 ,98%,$356 ,$348 
846639,GREENIES DOG DNTL CHW LGE 6OZ,64286310294, 42 , 47 ,(5),112%,$356 ,$378 
900701,GREENIES DOG DNTL CHW PTE,64286310700, 30 , 35 ,(5),117%,$149 ,$174 
19606,BDB NAT LOW FAT PB & MOLASSES,65922324060, 138 , 135 , 3 ,98%,$477 ,$467 
167216,BDB MORE FLAVORS DOG TREATS,65922324064, 222 , 219 , 3 ,99%,$768 ,$758 
38383,NR 13.2OZ STEW CHKN RICE,73052150761, 36 , 32 , 4 ,89%,$54 ,$48 
38441,NR 13.2OZ STEW LAMB & RICE,73052150762, 24 , 20 , 4 ,83%,$36 ,$30 
46517,NR 4LB GF SMALL BRD CHKN,73052151390, 76 , 77 ,(1),101%,$682 ,$692 
37893,NR 2.75OZ CHKN SLMN RCPE,73052151753, 132 , 126 , 6 ,95%,$132 ,$126 
38624,NR 12LB GF CHICKEN RECIPE,73052152101, 41 , 41 , 0 ,100%,"$1,003 ","$1,007 "
38590,NR 12LB GF SALMON RECIPE,73052152103, 35 , 34 , 1 ,97%,$852 ,$828 
816131,NR GF CHICKEN RECIPE,73052152206, 228 , 237 ,(9),104%,$228 ,$238 
0,KITTY WONDER LITTER BOX,73291500001, 39 , 33 , 6 ,85%,$117 ,$99 
357182,FM RECIPE W BEEF N SWT POTATO,81033902044, 48 , 41 , 7 ,85%,$61 ,$52 
357189,FM ROAST CHKN CARROT PEAS,81033902045, 24 , 26 ,(2),108%,$31 ,$33 
84014,FM GF JERKY BBQ BEEF W TOMATO,81033902054, 120 , 119 , 1 ,99%,$478 ,$474 
84030,FM GF JERKY TENDER LMB W RSMRY,81033902055, 96 , 95 , 1 ,99%,$382 ,$380 
84223,FM GF JERKY WILD GAME W APPLE,81033902056, 54 , 49 , 5 ,91%,$215 ,$195 
84061,FM GF JERKY CHKN W ROSEMARY,81033902057, 84 , 77 , 7 ,92%,$334 ,$308 
86832,FM CHKN TUNA LGHT IN CHKN BRTH,81033902074, 72 , 78 ,(6),108%,$90 ,$98 
351120,FM WHITEFISH SALMON OLV OIL,81033902080, 40 , 36 , 4 ,90%,$359 ,$323 
351125,FM CHKN TRKY CRNBRY,81033902082, 16 , 16 , 0 ,100%,$256 ,$256 
116286,LIL TEX RNCH CHX JRKY,81814501182, 18 , 16 , 2 ,89%,$107 ,$95 
112502,LIL TEX RNCH CHX JRKY,81814501185, 30 , 30 , 0 ,100%,$263 ,$263 
325722,VETIQ MINTIES DENTAL BONES SML,81814501568, 24 , 29 ,(5),121%,$80 ,$97 
0,VETIQ MINTIES DENTL BONES M/LG,81814501569, 33 , 35 ,(2),106%,$110 ,$116 
0,VETIQ MINTIES DENTAL BONES SML,81814501570, 48 , 45 , 3 ,94%,$396 ,$371 
0,VETIQ MINTIES DENTL BONES M/LG,81814501571, 50 , 49 , 1 ,98%,$412 ,$404 
334635,MM TNDR FAVORITE TUNA & SHRIMP,82927400615, 132 , 127 , 5 ,96%,$63 ,$61 
334636,MM TNDR FAVORITES SLMN & CRAB,82927400616, 120 , 114 , 6 ,95%,$58 ,$55 
334638,MM TNDR FAVORITES CHKN & BEEF,82927400617, 84 , 87 ,(3),104%,$40 ,$42 
48625,MM POULTRY & BEEF,82927400622, 76 , 69 , 7 ,91%,$436 ,$396 
220871,MM POULTRY & SEAFOOD,82927400623, 52 , 49 , 3 ,94%,$298 ,$282 
390049,MM SMPLE SRVNG TUNA SALMON,82927414802, 60 , 59 , 1 ,98%,$47 ,$46 
390067,MM SMPLE SRVNG 12CT SF VP,82927414837, 56 , 54 , 2 ,96%,$255 ,$247 
390074,MM SMPLE SRVNG 24CT SF VP,82927414851, 40 , 38 , 2 ,95%,$359 ,$341 
390045,MM SMPLE SRVNG TUNA WHTFSH,82927414961, 96 , 96 , 0 ,100%,$75 ,$75 
420973,MM BASTED BITES CKN TUNA,82927421880, 196 , 194 , 2 ,99%,$780 ,$773 
867692,MM BASTED BITES CKN TUNA,82927421920, 58 , 56 , 2 ,97%,$689 ,$665 
181921,MEOW MIX ORIGINAL,82927450225, 87 , 87 , 0 ,100%,"$1,034 ","$1,035 "
263014,MMIX TENDER FAV POULTRY/BEEF,82927450236, 66 , 66 , 0 ,100%,$718 ,$719 
237486,MMIX PATE TPRS VPK SEAFD&CHKN,82927451229, 44 , 46 ,(2),105%,$253 ,$264 
172073,MEOW MIX TENDERCENTRS SLMN-CKN,82927451250, 41 , 41 , 0 ,100%,$487 ,$487 
463876,MMIX TNDR CNTR SLM CHKN 3LB,82927451252, 124 , 128 ,(4),103%,$494 ,$511 
860307,MMIX ORIGINAL DRY CAT 3.15LB,82927451375, 152 , 154 ,(2),101%,$605 ,$614 
615543,MMIX ORIGINAL CAT FOOD 6.3LB,82927451376, 132 , 127 , 5 ,96%,"$1,027 ",$988 
472705,MEOW MIX IRR SOFT SALMON,82927452716, 132 , 119 , 13 ,90%,$192 ,$158 
818618,MM IRR CHKN TKY 2.5OZ,82927452719, 75 , 71 , 4 ,95%,$110 ,$105 
556220,BB HOMESTYLE CHIKN ADULT DOG,84024310017, 408 , 404 , 4 ,99%,$881 ,$873 
635591,BB WILD PUP TRKY & CHKN 12.5OZ,84024310123, 156 , 152 , 4 ,97%,$387 ,$377 
533384,BB WILD SR DOG TRKY & CHK 12.5,84024310124, 96 , 102 ,(6),106%,$238 ,$253 
559081,BB DOG WOLF CRK STW BEEF 12.5,84024310128, 180 , 178 , 2 ,99%,$446 ,$441 
955642,BB WILD BITS TRAIL TRTS SALMON,84024310132, 48 , 48 , 0 ,100%,$240 ,$240 
804038,BB PATE KITTEN CHICKEN ENTREE,84024310212, 72 , 69 , 3 ,96%,$71 ,$69 
493941,BB PATE ADULT INDOOR CHKN,84024310213, 72 , 74 ,(2),103%,$71 ,$73 
642092,BB FLAKED FISH & SHRIMP,84024310220, 240 , 232 , 8 ,97%,$238 ,$230 
800190,BB FLAKED CHICKEN CAT,84024310221, 72 , 45 , 27 ,63%,$95 ,$45 
811896,BB MEATY MORSELS TUNA,84024310226, 144 , 154 ,(10),107%,$143 ,$153 
421725,BB BLUE PATE ADULT CHICK 5.5OZ,84024310230, 312 , 317 ,(5),102%,$381 ,$387 
581509,BB CHIKN RICE ADULT DOG SMALL,84024310487, 115 , 116 ,(1),101%,"$1,838 ","$1,854 "
734548,BB HOMESTYLE CHKN DOG FOOD,84024310493, 312 , 317 ,(5),102%,$674 ,$686 
823362,BB HOMESTYLE REC LAMB 12.5OZDG,84024310494, 264 , 267 ,(3),101%,$570 ,$578 
957650,BB HOMESTYLE BEEF DOG FOOD,84024310495, 300 , 298 , 2 ,99%,$648 ,$646 
721089,BB HOMESTYLE TURKEY DOG FOOD,84024310496, 228 , 230 ,(2),101%,$492 ,$498 
668362,BB CHIKN STEW DOG FOOD,84024310519, 180 , 182 ,(2),101%,$446 ,$452 
515290,BB BEEF STEW DOG FOOD,84024310521, 132 , 145 ,(13),110%,$327 ,$360 
674910,BB WILD ADLT DOG CHKN,84024310532, 25 , 25 , 0 ,100%,$475 ,$475 
826017,BB WILD ADLT DOG CHICKEN,84024310533, 35 , 35 , 0 ,100%,"$1,049 ","$1,050 "
866159,BB WILDRNSS ADLT DOG SALMN,84024310535, 30 , 30 , 0 ,100%,$569 ,$570 
622974,BB WILD ADT DOG SALMON,84024310536, 35 , 34 , 1 ,97%,"$1,200 ","$1,167 "
895444,BB HOMESTYLE CHIKN DINR SMALL,84024310550, 264 , 249 , 15 ,94%,$438 ,$414 
642941,BB FAM FAV BBQ DOG FOOD,84024310554, 156 , 146 , 10 ,94%,$387 ,$362 
715377,BB FAM FAV TURKEY DOG FOOD,84024310557, 108 , 113 ,(5),105%,$268 ,$280 
824074,BB HBR APPL & YOG 16OZ DOG,84024310561, 64 , 98 ,(34),153%,$287 ,$441 
463600,BB HOMESTYLE CHIKN PUPPY FOOD,84024310573, 84 , 81 , 3 ,96%,$181 ,$175 
523432,BB HBR BAC EGG & CH 16OZ DOG,84024310633, 204 , 212 ,(8),104%,$916 ,$953 
517978,BB WILD DOG SALMN & CHK 12.5OZ,84024311292, 192 , 189 , 3 ,98%,$448 ,$443 
413311,BB CHICKEN BITS VALUE SIZE DOG,84024311665, 78 , 81 ,(3),104%,$622 ,$649 
458441,BB KITTY CRAVINGS CHICKEN,84024312021, 30 , 26 , 4 ,87%,$54 ,$47 
870559,BB KITTY CRAVINGS SALMON,84024312023, 36 , 39 ,(3),108%,$64 ,$70 
957847,BB KITTY CRAVINGS TUNA,84024312025, 36 , 32 , 4 ,89%,$64 ,$57 
918762,BB HLTHY ADULT VARIETY FLAKED,84024312122, 110 , 110 , 0 ,100%,"$1,207 ","$1,208 "
476680,BB HLTHY KITTEN VARIETY PACK,84024312124, 52 , 50 , 2 ,96%,$254 ,$244 
979515,BB CHIKN ADULT CAT FOOD,84024312239, 8 , 8 , 0 ,100%,$192 ,$192 
624491,BB ADLT CAT INDR HAIRBALL,84024312242, 20 , 22 ,(2),110%,$320 ,$349 
671825,BB ADULT CAT INDOOR FORMULA,84024312243, 18 , 17 , 1 ,94%,$432 ,$408 
973259,BB ADULT CAT INDOOR FORMULA,84024312244, 36 , 30 , 6 ,83%,$311 ,$261 
729627,BB ADULT CAT INDOOR,84024312245, 35 , 38 ,(3),109%,$554 ,$604 
876782,BB ADULT CAT INDOOR SALMON,84024312246, 18 , 20 ,(2),111%,$150 ,$167 
547500,BB ADULT CAT INDOOR SALMON,84024312247, 15 , 16 ,(1),107%,$240 ,$255 
926953,BB CHIKN SENSTV ADULT CAT FOOD,84024312248, 10 , 10 , 0 ,100%,$240 ,$241 
713112,BB ADULT CAT SS CHKN,84024312249, 48 , 41 , 7 ,85%,$413 ,$355 
427331,BB ADULT CAT SS CKN,84024312250, 30 , 30 , 0 ,100%,$469 ,$468 
618700,BB ADULT CAT WEIGHT CONTROL,84024312251, 36 , 36 , 0 ,100%,$323 ,$318 
637162,BB KITTEN FORMULA,84024312253, 42 , 42 , 0 ,100%,$371 ,$374 
986504,BB ADLT INDOOR CAT CKN GF,84024312255, 24 , 27 ,(3),113%,$204 ,$226 
861334,BB MATURE CAT FORMULA,84024312257, 0 , 3 ,(3),N/A,$0 ,$48 
831218,BB LPF CHIKN ADULT DOG FOOD,84024312258, 100 , 96 , 4 ,96%,"$3,912 ","$3,760 "
973634,BB LPF CHIKN LRG ADUL DOG FOOD,84024312260, 64 , 64 , 0 ,100%,"$2,555 ","$2,562 "
470464,BB ADULT DOG CKN SM BREED,84024312261, 125 , 122 , 3 ,98%,"$1,248 ","$1,221 "
576657,BB ADULT DOG LAMB & BRN RICE,84024312263, 25 , 26 ,(1),104%,$250 ,$260 
471395,BB PUPPY CHKN & BRN RICE,84024312264, 30 , 40 ,(10),133%,$299 ,$401 
556172,BB SENIOR CHN & BRN RICE DOG,84024312265, 45 , 44 , 1 ,98%,$450 ,$440 
524666,BB GF ADLT CKN 10LB DG,84024312266, 68 , 65 , 3 ,96%,"$1,767 ","$1,697 "
511171,BB GRAIN FREE CHICKEN ADULT,84024312267, 70 , 70 , 0 ,100%,"$1,189 ","$1,180 "
951755,BB GRN FR CHIKN PUPPY FOOD,84024312268, 18 , 17 , 1 ,94%,$468 ,$442 
427608,BB GRAIN FREE CHICKEN PUPPY,84024312269, 25 , 27 ,(2),108%,$424 ,$458 
975824,BB BEEF BITS VALUE SIZE DOG,84024312272, 78 , 80 ,(2),103%,$622 ,$640 
732535,BB KITTY CRAVINGS CHICKEN,84024312289, 18 , 16 , 2 ,89%,$63 ,$56 
520091,BB HLTHY ADULT VARIETY PATE,84024312297, 50 , 51 ,(1),102%,$549 ,$559 
985540,BB STIX BEEF 6OZ DOG,84024312299, 96 , 92 , 4 ,96%,$575 ,$549 
441720,BB LAMB & RICE ADULT DOG 22 LB,84024312493, 29 , 30 ,(1),103%,"$1,130 ","$1,169 "
781536,BB HR GF CHKN W/VEG DOG,84024312513, 228 , 236 ,(8),104%,$477 ,$494 
430507,BB HR GF BEEF W/VEG DOG,84024312514, 192 , 196 ,(4),102%,$401 ,$410 
776331,BB WILDRNSS WILD BITS CHKN,84024312538, 24 , 25 ,(1),104%,$287 ,$300 
674901,BB WILD ADLT DOG CHICKEN,84024313068, 45 , 43 , 2 ,96%,"$2,070 ","$1,980 "
708780,BB WILD ADLT DOG DUCK,84024313069, 6 , 6 , 0 ,100%,$294 ,$294 
785321,BB WILDERNESS ADLT DOG SALMON,84024313071, 26 , 27 ,(1),104%,"$1,274 ","$1,323 "
413082,BB WILD LB ADLT DOG CHICKEN,84024313072, 28 , 28 , 0 ,100%,"$1,288 ","$1,288 "
497281,BB WILDERNESS PUPPY CHICKEN,84024313075, 18 , 18 , 0 ,100%,$828 ,$828 
662600,BB ROCKY MT ADLT DOG RED MEAT,84024313078, 45 , 43 , 2 ,96%,$855 ,$817 
138231,TX LONESTAR TREATS BEEF JERKY,84423204776, 24 , 24 , 0 ,100%,$180 ,$180 
443095,MIX HAIRBALL CAT FOOD 6.3LB,85159900040, 64 , 62 , 2 ,97%,$498 ,$483 
363742,BUCKLEY TRAINERS TREATS CHCKN,85645200506, 40 , 39 , 1 ,98%,$200 ,$195 
738156,BUCKLEY BEEF LUNG JERKY,85660500501, 36 , 35 , 1 ,97%,$180 ,$175 
238432,FORTIS CAT TREATS GRILLED TUNA,85705100347, 480 , 441 , 39 ,92%,$422 ,$388 
238435,FORTIS CAT TREATS SIMM SALMON,85705100348, 440 , 437 , 3 ,99%,$387 ,$385 
238446,CALICO BAY SKIPJACK TUNA,85705100353, 468 , 463 , 5 ,99%,$187 ,$185 
238448,CALICO BAY TUNA & MACKEREL,85705100354, 252 , 203 , 49 ,81%,$101 ,$81 
238455,CALICO BAY TUNA & WHITEFISH,85705100355, 468 , 402 , 66 ,86%,$187 ,$161 
351759,CB TUNA & SALMON IN GRAVY,85705100375, 70 , 65 , 5 ,93%,$35 ,$33 
351754,CB TUNA & PUMPKIN,85705100376, 42 , 42 , 0 ,100%,$21 ,$21 
378607,CALICO BAY VARIETY PACK,85705100377, 42 , 40 , 2 ,95%,$252 ,$240 
351766,PARAMOUNT CHICKEN STEW W VEG,85705100378, 104 , 103 , 1 ,99%,$155 ,$153 
351763,PARAMOUNT LAMB AND CHCKEN STEW,85705100380, 72 , 67 , 5 ,93%,$107 ,$100 
351775,PARAMOUNT CHICKEN & BEEF W VEG,85705100381, 88 , 94 ,(6),107%,$131 ,$140 
370219,PARAMOUNT VALUE PACK,85705100385, 30 , 26 , 4 ,87%,$263 ,$228 
0,CATCHUP CAT SUPPLEMENT SALMON,85736400404, 0 , 5 ,(5),N/A,$0 ,$30 
115692,PETCHUP MWTRD LIQ CAT SPPLMNT,85736400406, 0 , 2 ,(2),N/A,$0 ,$12 
815013,BB CHICKEN PUPPY FOOD,85961000001, 45 , 43 , 2 ,96%,$719 ,$688 
864809,BB HLTHY WGHT ADULT DOG FOOD,85961000002, 40 , 42 ,(2),105%,$639 ,$671 
846165,BB LPF CHIKN PUPPY FOOD,85961000003, 43 , 43 , 0 ,100%,"$1,289 ","$1,293 "
478567,BB LPF HW CHIKN ADULT DOG FOOD,85961000004, 50 , 48 , 2 ,96%,"$1,499 ","$1,430 "
743821,BB CHIKN ADULT DOG FOOD,85961000007, 115 , 113 , 2 ,98%,"$1,837 ","$1,808 "
737227,BB LPF CHIKN ADULT DOG FOOD,85961000009, 81 , 83 ,(2),102%,"$2,429 ","$2,487 "
908136,BB CHIKN SENIOR DOG FOOD,85961000013, 55 , 58 ,(3),105%,$879 ,$929 
915358,BB LPF CHIKN SENIOR DOG FOOD,85961000015, 61 , 63 ,(2),103%,"$1,829 ","$1,894 "
630296,BB LPF FISH ADULT DOG FOOD,85961000030, 44 , 45 ,(1),102%,"$1,319 ","$1,352 "
992247,BB LAMB ADULT DOG FOOD,85961000033, 30 , 31 ,(1),103%,$479 ,$495 
599448,BB LPF LAMB ADULT DOG FOOD,85961000035, 29 , 30 ,(1),103%,$869 ,$899 
405907,BB LPF CHIKN LRG PUPPY FOOD,85961000042, 8 , 8 , 0 ,100%,$240 ,$241 
868464,BB BITS CHICKEN 4OZ DOG,85961000518, 78 , 68 , 10 ,87%,$311 ,$272 
696772,BB WILD TURKEY & CHKN BISCUIT,85961000544, 36 , 38 ,(2),106%,$215 ,$228 
564523,BB WILD DUCK & CHKN BISCUIT,85961000548, 30 , 33 ,(3),110%,$179 ,$198 
489463,BB WILD PUPPY CHICKEN,85961000563, 20 , 24 ,(4),120%,$380 ,$456 
653300,BB WILD SB ADULT DOG CHK,85961000567, 30 , 35 ,(5),117%,$570 ,$665 
658710,BB BLUE WLD SB AD DOG CHICKEN,85961000569, 22 , 21 , 1 ,95%,$659 ,$630 
757075,BB FAM FAV CHIKN DOG FOOD,85961000685, 108 , 109 ,(1),101%,$268 ,$270 
588149,BB HOMESTYLE CHIKN SENIOR DOG,85961000747, 564 , 568 ,(4),101%,"$1,218 ","$1,227 "
140377,ULTRA CHEWY CHICKEN DOG BONE,87786900128, 768 , 781 ,(13),102%,$768 ,$783 
557211,NUMI CAT LITTER,750151480001, 0 , 0 , 0 ,N/A,$0 ,$0 