334695,HR DRY CAT GF CHICKEN&CHIC PEA,4122001224, 144 , 135 , 9 ,94%,$216 ,$203 
334655,HR DRY CAT GRAIN FREE KITTEN,4122001225, 90 , 87 , 3 ,97%,$135 ,$131 
841391,HCF DRY CAT ORIGINAL,4122001364, 16 , 5 , 11 ,31%,$40 ,$12 
790373,HCF DRY CAT ORIGINAL,4122001365, 25 , 22 , 3 ,88%,$122 ,$107 
307617,HCF CAT POUCH SEAFD VARIETY PK,4122002013, 118 , 118 , 0 ,100%,$506 ,$508 
307618,HCF CAT POUCH POLTRY VRIETY PK,4122002014, 112 , 109 , 3 ,97%,$480 ,$464 
307614,HCF CAT CAN SEAFOOD VP 24/3OZ,4122002015, 34 , 33 , 1 ,97%,$374 ,$364 
129659,HCF CAT CAN POULTRY VP 24/3OZ,4122002016, 15 , 15 , 0 ,100%,$165 ,$165 
307612,HCF CAT CAN SEAFOOD VP 24/5.5Z,4122002017, 7 , 7 , 0 ,100%,$66 ,$66 
307610,HCF CAT CAN POULTRY VP 24/5.5Z,4122002018, 8 , 8 , 0 ,100%,$76 ,$76 
307609,HCF CAT CAN TURKEY & GIBLETS,4122002019, 84 , 85 ,(1),101%,$57 ,$58 
307608,HCF CAT FOOD CAN SALMON,4122002020, 180 , 178 , 2 ,99%,$122 ,$121 
307607,HCF CAT FOOD CAN - MIXED GRILL,4122002021, 60 , 66 ,(6),110%,$41 ,$45 
311737,HEB TEXAS PETS MINI BURGER,4122004115, 126 , 126 , 0 ,100%,$863 ,$861 
311739,HEB TEXAS PETS SUMMER SAUSAGE,4122004117, 168 , 163 , 5 ,97%,"$1,151 ","$1,117 "
313128,HEB CHICKEN JERKY TREATS 24OZ,4122004300, 762 , 656 , 106 ,86%,"$11,422 ","$9,802 "
307322,HCF CAT CAN WHITEFISH & TUNA,4122005158, 96 , 137 ,(41),143%,$43 ,$62 
287078,HCF CAT CAN SALMON,4122005160, 120 , 120 , 0 ,100%,$54 ,$54 
280669,HCF CAT CAN COD COLE & SHRIMP,4122005162, 144 , 128 , 16 ,89%,$65 ,$58 
284083,HCF CAT CAN LIVER & CHICKEN,4122005164, 168 , 129 , 39 ,77%,$76 ,$58 
280594,HCF DOG CAN BEEF,4122005170, 24 , 13 , 11 ,54%,$12 ,$7 
694076,HEB DRY CAT KITTEN FORMULA,4122005224, 64 , 66 ,(2),103%,$210 ,$216 
560194,HEB DRY CAT KITTEN FORMULA,4122005225, 48 , 51 ,(3),106%,$287 ,$306 
22263,HEB PUDDLE BUSTERS,4122005255, 212 , 212 , 0 ,100%,"$1,800 ","$1,799 "
496831,HEB DRY CAT GULF COAST MORSELS,4122006096, 27 , 29 ,(2),107%,$188 ,$203 
294418,HR DRY CAT GF CHICKEN&CHIC PEA,4122006351, 25 , 26 ,(1),104%,$450 ,$468 
353739,HEB PUDDLE BUSTER LAVENDER,4122007808, 212 , 152 , 60 ,72%,"$1,800 ","$1,284 "
335493,HEB PUDDLE BUSTERS JUMBO,4122008240, 128 , 129 ,(1),101%,"$2,432 ","$2,452 "
195216,HERITAGE RANCH APPLE DOG SNCKS,4122010286, 192 , 194 ,(2),101%,$668 ,$675 
13585,HCF DOG POUCH BF/CK/TK VP,4122010297, 72 , 73 ,(1),101%,$409 ,$415 
3602,HR GRAIN FREE CHICKEN DRY DOG,4122010455, 100 , 101 ,(1),101%,$998 ,"$1,008 "
351116,HEB SMOKED PORK DRY DOG FOOD,4122011098, 74 , 75 ,(1),101%,$739 ,$750 
377178,HEB BACON&CHSE DRY DOG FOOD,4122011108, 51 , 51 , 0 ,100%,$509 ,$500 
356803,HR DENTAL STKS APL GRN TEA,4122014299, 126 , 125 , 1 ,99%,$377 ,$374 
356804,HR DENTAL STKS PEPPERMNT PRSLY,4122014300, 132 , 130 , 2 ,98%,$395 ,$389 
356805,HR DENTAL STKS APPL GRN TEA,4122014301, 164 , 161 , 3 ,98%,"$1,146 ","$1,126 "
356807,HR DENTAL STK PEPPERMNT PRSLY,4122014302, 196 , 195 , 1 ,99%,"$1,370 ","$1,364 "
278235,HEB HEALTHY BITES WGHT MGMT,4122017053, 54 , 55 ,(1),102%,$537 ,$547 
278138,HEB SENIOR FORMULA,4122017356, 36 , 35 , 1 ,97%,$359 ,$345 
334664,HR DRY DOG CHICKEN SAMPLE,4122017881, 294 , 289 , 5 ,98%,$441 ,$434 
334648,HR DRY DOG GF CHICKEN SAMPLE,4122018074, 192 , 180 , 12 ,94%,$288 ,$270 
20470,HEB PUDDLE BUSTERS,4122018149, 164 , 186 ,(22),113%,"$2,540 ","$2,884 "
762314,HEB DRY CAT INDOOR FORMULA,4122018365, 86 , 90 ,(4),105%,$282 ,$296 
579281,HEB SMALL BITES 8LB,4122018658, 103 , 103 , 0 ,100%,$564 ,$565 
275608,HEB TEXAS BBQ MORSELS,4122018834, 7 , 6 , 1 ,86%,$77 ,$65 
275604,HEB CAT FOOD ADULT COMPLETE,4122019016, 32 , 29 , 3 ,91%,$319 ,$289 
370226,HR JUMBO BISCUITS PUMPKIN CIN,4122020980, 180 , 150 , 30 ,83%,$180 ,$150 
370229,HR JMBO BISCT GINGERBREAD,4122020983, 180 , 138 , 42 ,77%,$180 ,$138 
22685,HCF CAT POUCH WHITEFISH & TUNA,4122024527, 96 , 95 , 1 ,99%,$36 ,$35 
20322,HCF CAT POUCH STEAK & SHRIMP,4122024529, 216 , 211 , 5 ,98%,$80 ,$78 
159374,HCF DOG POUCH FILET MIGNON,4122024542, 96 , 97 ,(1),101%,$48 ,$49 
159355,HCF DOG CAN BF/CK GVP 12/13.2,4122024543, 29 , 29 , 0 ,100%,$203 ,$200 
456684,HEB DRY CAT 4 FLAVOR MORSEL,4122024560, 64 , 61 , 3 ,95%,$210 ,$200 
380876,HR CHICKEN & BRN RICE DRY DOG,4122024726, 70 , 69 , 1 ,99%,"$3,150 ","$3,109 "
380879,HR GF BEEF & CHICKPEA DRY DOG,4122024754, 142 , 144 ,(2),101%,"$2,539 ","$2,579 "
380885,HR GF BEEF & CHICKPEA DRY DOG,4122024759, 39 , 36 , 3 ,92%,"$1,481 ","$1,370 "
380888,HR GF BEEF & CHICKPEA DRY DOG,4122024768, 34 , 32 , 2 ,94%,"$1,632 ","$1,539 "
380890,HR GF BEEF & CHICKPEA DRY DOG,4122024773, 72 , 74 ,(2),103%,$719 ,$739 
380892,HR LAMB & BRN RICE DRY DOG,4122024792, 40 , 38 , 2 ,95%,"$1,800 ","$1,711 "
380895,HR PUPPY FOOD DRY DOG,4122024806, 103 , 96 , 7 ,93%,"$1,842 ","$1,718 "
906533,HEB DRY CAT ADULT COMPLETE,4122024887, 35 , 34 , 1 ,97%,$244 ,$237 
5948,HR HEALTHY WGHT TURKEY DRY DOG,4122025118, 144 , 138 , 6 ,96%,"$1,120 ","$1,073 "
1777,HR GRAIN FREE CHICKEN DRY DOG,4122025163, 162 , 151 , 11 ,93%,"$2,897 ","$2,702 "
2139,HR GRAIN FREE CHICKEN DRY DOG,4122025368, 88 , 87 , 1 ,99%,"$3,342 ","$3,296 "
4707,HR GRAIN FREE SALMON DRY DOG,4122025485, 140 , 149 ,(9),106%,"$1,397 ","$1,488 "
389425,HEB CHICKEN & WAFFLE FLAVOR,4122029458, 96 , 95 , 1 ,99%,$430 ,$426 
9285,HR RB CKN&BRN RC DRY DOG FD,4122029879, 265 , 255 , 10 ,96%,"$4,738 ","$4,567 "
4845,HR GRAIN FREE SALMON DRY DOG,4122030815, 135 , 128 , 7 ,95%,"$5,262 ","$4,989 "
359298,HCF CHOPPED BURGER,4122033186, 60 , 60 , 0 ,100%,$220 ,$221 
355615,HCF CHOPPED BURGER WITH CHEESE,4122033187, 76 , 77 ,(1),101%,$279 ,$283 
538368,HEB BBQ BRISKET FLAVOUR STRIP,4122037915, 192 , 186 , 6 ,97%,$860 ,$834 
10893,HR RB LAMB&BRN RC DRY DOG,4122039535, 80 , 73 , 7 ,91%,$718 ,$656 
583747,HERITAGE RANCH BY HEB MOBILITY,4122055629, 108 , 110 ,(2),102%,$647 ,$659 
929985,HERITAGE RANCH BY HEB COGNITIV,4122055632, 108 , 99 , 9 ,92%,$647 ,$593 
480778,HERITAGE RANCH BY HEB ANTIOXID,4122055634, 72 , 68 , 4 ,94%,$431 ,$408 
617638,HEB ODOR CNTRL UNS 20 LB BAG,4122057561, 147 , 147 , 0 ,100%,$725 ,$718 
278231,HEB TEXAS BBQ BRISKET DRY DOG,4122058664, 73 , 70 , 3 ,96%,"$1,349 ","$1,294 "
802875,HCF NON-CLUMPING UNSCENTED,4122060122, 80 , 77 , 3 ,96%,$118 ,$114 
439506,HEB CLMPNG LTTR LTWGHT SCNTD,4122060905, 76 , 70 , 6 ,92%,$752 ,$695 
607574,HEB CLMPNG LTTR MLTI CAT SCNTD,4122060908, 38 , 36 , 2 ,95%,$170 ,$162 
703208,HEB CLMPNG LTTR MLTI CAT SCNTD,4122060911, 67 , 63 , 4 ,94%,$485 ,$453 
834435,HEB CLMPNG LTTR MLTI CAT SCNTD,4122060912, 35 , 35 , 0 ,100%,$430 ,$421 
943108,HEB CLMPNG LTTR ODR CNTRL SCNT,4122060913, 195 , 195 , 0 ,100%,"$1,022 ","$1,025 "
929606,HEB CLMPNG LTTR ODR CNTRL SCNT,4122060914, 404 , 404 , 0 ,100%,"$2,925 ","$2,931 "
734106,HEB CLMPNG LTTR ODR CNTRL SCNT,4122060915, 65 , 63 , 2 ,97%,$811 ,$788 
661350,HEB CLMPNG LTTR ODR CNTRL UNSC,4122060917, 126 , 125 , 1 ,99%,$665 ,$661 
581208,HEB CLMPNG LTTR ODR CNTRL UNSC,4122060918, 474 , 481 ,(7),101%,"$3,309 ","$3,361 "
991517,HEB CLMPNG LTTR ODR CNTRL UNSC,4122060920, 65 , 62 , 3 ,95%,$779 ,$743 
980771,HCF CAT CAN CHICKEN,4122063405, 72 , 58 , 14 ,81%,$29 ,$23 
980953,HCF CAT CAN OCN WHTFSH & TUNA,4122063406, 144 , 145 ,(1),101%,$58 ,$58 
980888,HCF CAT CAN LIVER & BACON,4122063408, 144 , 153 ,(9),106%,$58 ,$62 
981613,HCF CAT CAN TURKEY & GIBLETS,4122063409, 96 , 84 , 12 ,88%,$38 ,$34 
981043,HCF CAT CAN SALMON,4122063416, 168 , 181 ,(13),108%,$67 ,$72 
980904,HCF CAT CAN MARINERS CATCH,4122063417, 72 , 56 , 16 ,78%,$29 ,$22 
278229,HEB TEXAS BBQ BRISKET DRY DOG,4122064671, 146 , 141 , 5 ,97%,"$1,457 ","$1,409 "
70232,HCF DOG POUCH CTST/FLM/L&R VP,4122064915, 58 , 60 ,(2),103%,$329 ,$341 
70167,HCF DOG CAN CK/L&R - 12/13.2,4122064916, 24 , 23 , 1 ,96%,$168 ,$161 
278134,HEB SMALL BITES,4122065923, 59 , 56 , 3 ,95%,$530 ,$503 
235310,HEB ADULT DRY DOG FOOD 50LB,4122066156, 185 , 179 , 6 ,97%,"$3,672 ","$3,560 "
278230,HEB HEALTHY BITES ORIGINAL,4122066192, 55 , 52 , 3 ,95%,$547 ,$517 
67775,HCF CAT POUCH CHICKEN & GRAVY,4122067509, 312 , 315 ,(3),101%,$115 ,$117 
67781,HCF CAT POUCH TURKEY & GIBLETS,4122067510, 144 , 131 , 13 ,91%,$53 ,$49 
67783,HCF CAT POUCH TUNA,4122067512, 240 , 261 ,(21),109%,$89 ,$97 
67762,HCF DOG POUCH BEEF & GRAVY,4122067517, 48 , 53 ,(5),110%,$24 ,$27 
67766,HCF DOG POUCH TURKEY & GRAVY,4122067519, 72 , 79 ,(7),110%,$36 ,$40 
60570,HCF DOG CAN TURKEY & BACON,4122067521, 84 , 82 , 2 ,98%,$49 ,$48 
60528,HCF DOG CAN LAMB & RICE,4122067527, 108 , 113 ,(5),105%,$63 ,$66 
60523,HCF DOG CAN CK/BEEF/LIVER,4122067528, 96 , 101 ,(5),105%,$92 ,$97 
62883,HCF DOG CAN BF CUTS - 6/22OZ,4122067532, 2 , 1 , 1 ,50%,$12 ,$6 
62886,HCF DOG CAN CHPD BF - 6/22OZ,4122067533, 3 , 3 , 0 ,100%,$17 ,$17 
72449,HCF CHOPPED BURGER,4122067650, 16 , 16 , 0 ,100%,$174 ,$174 
72450,HCF CHOPPED BURGER WITH CHEESE,4122067651, 31 , 30 , 1 ,97%,$337 ,$326 
318758,HCF DOG CAN SENIOR TRKY & RICE,4122068706, 24 , 19 , 5 ,79%,$12 ,$10 
347732,HCF DOG CAN SENIOR BEEF & RICE,4122068707, 24 , 10 , 14 ,42%,$12 ,$5 
318089,HCF DOG CAN CHICKEN CUTS,4122068708, 24 , 17 , 7 ,71%,$12 ,$8 
305573,HCF DOG CAN PUPPY,4122068709, 48 , 47 , 1 ,98%,$24 ,$24 
305557,HCF DOG CAN BEEF/BCN/CHSBRG,4122068710, 24 , 28 ,(4),117%,$12 ,$14 
244418,HCF DOG CAN CHICKEN & RICE,4122068714, 156 , 155 , 1 ,99%,$90 ,$90 
290221,HCF DOG CAN CHICKEN CUTS,4122068715, 84 , 80 , 4 ,95%,$81 ,$77 
7350,HR RB CKN&BRN RC DRY DOG FD,4122071568, 364 , 362 , 2 ,99%,"$2,868 ","$2,859 "
4727,HR GRAIN FREE SALMON DRY DOG,4122071705, 238 , 231 , 7 ,97%,"$4,255 ","$4,132 "
11033,HR RB LAMB&BRN RC DRY DOG,4122078106, 180 , 179 , 1 ,99%,"$3,416 ","$3,392 "
550660,HEB DRY CAT YUMMY BREAKFAST,4122078873, 27 , 29 ,(2),107%,$161 ,$173 
278131,HEB TEXAS SPORTING DOG FORMULA,4122079201, 46 , 47 ,(1),102%,$850 ,$851 
979411,HEB DRY CAT GULF COAST MORSELS,4122079319, 92 , 92 , 0 ,100%,$302 ,$302 
294403,HR DRY CAT GF SALMON&CHICK PEA,4122079427, 132 , 131 , 1 ,99%,"$1,317 ","$1,300 "
671246,HEB DRY CAT INDOOR FORMULA,4122079489, 53 , 49 , 4 ,92%,$370 ,$342 
747958,HEB DRY CAT ADULT COMPLETE,4122079630, 68 , 76 ,(8),112%,$223 ,$249 
275579,HEB CAT FOOD 4 FLAVOR MORSEL,4122080141, 73 , 73 , 0 ,100%,$721 ,$723 
275582,HEB CAT FD YUMMY BREAKFAST MIX,4122080288, 33 , 29 , 4 ,88%,$319 ,$281 
505952,HEB DRY CAT YUMMY BREAKFAST,4122080292, 20 , 20 , 0 ,100%,$66 ,$65 
974528,HEB DRY CAT 4 FLAVOR MORSEL,4122080296, 48 , 47 , 1 ,98%,$335 ,$328 
275606,HEB TX BBQ FLAVOR CAT FOOD,4122080326, 16 , 11 , 5 ,69%,$112 ,$77 
294399,HR DRY CAT GF CHICKEN&CHIC PEA,4122080662, 96 , 96 , 0 ,100%,$958 ,$959 
275593,HEB CAT FOOD INDOOR FORMULA,4122081223, 74 , 73 , 1 ,99%,$731 ,$722 
334693,HR DRY DOG GF SALMON SAMPLE,4122081306, 330 , 323 , 7 ,98%,$495 ,$485 
275587,HEB CAT FOOD SMOKEHOUSE MORSEL,4122082029, 16 , 15 , 1 ,94%,$64 ,$60 
953815,HEB DOG FOOD WITH BEEF,4122083245, 630 , 653 ,(23),104%,$315 ,$327 
402293,HEB DOG FOOD GRILLED CHICKEN,4122083457, 240 , 245 ,(5),102%,$120 ,$123 
680467,HEB TP CHICKEN & SIRLOIN VP,4122083502, 90 , 87 , 3 ,97%,$539 ,$521 
138245,HCF DOG BISCUIT PEANUT BUTTER,4122084049, 234 , 236 ,(2),101%,$466 ,$470 
195218,HERITAGE RANCH PUMPKN DOG SNCK,4122084225, 184 , 196 ,(12),107%,$640 ,$683 
64261,HCF CAT CAN FLAKED TROUT,4122084505, 96 , 51 , 45 ,53%,$43 ,$23 
138240,HCF DOG BISCUIT ORIGINAL LARGE,4122084713, 80 , 78 , 2 ,98%,$302 ,$294 
12182,HEB BARKING STRIPS 8PK,4122084971, 88 , 89 ,(1),101%,$174 ,$177 
161808,HEB BARKIN STRIPS,4122084974, 324 , 329 ,(5),102%,"$1,797 ","$1,804 "
161625,HEB BARKIN STRIPS BACON/CHEESE,4122084983, 88 , 91 ,(3),103%,$385 ,$398 
161594,HEB JERKY STIX,4122084987, 160 , 163 ,(3),102%,$317 ,$323 
161546,HEB JERKY STIX,4122084989, 140 , 142 ,(2),101%,"$1,103 ","$1,119 "
161128,HEB PRIME CHOPS,4122084992, 180 , 178 , 2 ,99%,$356 ,$355 
160907,HEB SMOKEY WRAPS,4122084993, 140 , 134 , 6 ,96%,$277 ,$267 
220901,HEB CAT TREATS - OCEANFISH,4122084996, 72 , 71 , 1 ,99%,$85 ,$84 
220903,HEB CAT TREATS - TUNA,4122084998, 60 , 63 ,(3),105%,$71 ,$74 
235320,HEB PUPPY DRY DOG FOOD 15.5LB,4122085339, 49 , 46 , 3 ,94%,$427 ,$400 
783335,HEB PUPPY FOOD CHICKEN & BEEF,4122086167, 150 , 155 ,(5),103%,$75 ,$78 
558837,HEB DOG FOOD BACON & EGG,4122086171, 360 , 363 ,(3),101%,$180 ,$182 
522648,HEB DOG FOOD CHICKEN & LIVER,4122086174, 480 , 486 ,(6),101%,$240 ,$243 
686077,HEB DOG FOOD PORTERHOUSE,4122086175, 330 , 329 , 1 ,100%,$165 ,$165 
901562,HEB DOG FOOD FILET MIGNON,4122086176, 945 , 918 , 27 ,97%,$480 ,$459 
782636,HEB DOG FOOD SIRLOIN,4122086177, 420 , 417 , 3 ,99%,$210 ,$208 
294401,HR GRAIN FREE KITTEN DRY CAT,4122086192, 36 , 20 , 16 ,56%,$359 ,$200 
697113,HEB TP FILET MIGNON PORTER VP,4122086218, 135 , 132 , 3 ,98%,$809 ,$791 
573921,HERITAGE RANCH GF PUPPY,4122086225, 28 , 25 , 3 ,89%,$279 ,$250 
446706,HERITAGE RANCH LID DUCK,4122086236, 36 , 30 , 6 ,83%,$464 ,$386 
515930,HERITAGE RANCH LID DUCK,4122086237, 44 , 39 , 5 ,89%,$919 ,$815 
454758,HERITAGE RANCH SMALL BREED,4122086238, 44 , 35 , 9 ,80%,$391 ,$310 
754306,HERITAGE RANCH SENIOR SALMON,4122086252, 46 , 44 , 2 ,96%,$914 ,$875 
235176,HEB ADULT DRY DOG FOOD 20LB,4122087310, 131 , 126 , 5 ,96%,"$1,373 ","$1,327 "
793766,HEB HR SALMON LAMB VP,4122087892, 2 , 0 , 2 ,0%,$11 ,$0 
393159,HEB PUPPY DRY DOG FOOD 8LB,4122087926, 112 , 107 , 5 ,96%,$504 ,$482 
654714,HEB HR TURKEY SWEET POTATO,4122088065, 12 , 2 , 10 ,17%,$12 ,$2 
223088,HCF CAT CAN GRILLED SALMON,4122088211, 0 , 5 ,(5),N/A,$0 ,$2 
223087,HCF CAT CAN GRILLED BEEF,4122088212, 72 , 56 , 16 ,78%,$32 ,$25 
223083,HCF CAT CAN SHREDDED CHICKEN,4122088214, 72 , 62 , 10 ,86%,$29 ,$25 
223082,HCF CAT CAN SHREDDED CK/SAL,4122088215, 72 , 63 , 9 ,88%,$29 ,$25 
223084,HCF CAT CAN SHREDDED TK&CHZ,4122088216, 48 , 56 ,(8),117%,$19 ,$22 
223079,HCF CAT CAN SHREDDED VP,4122088217, 2 , 3 ,(1),150%,$22 ,$33 
223085,HCF CAT CAN GRILLED VP,4122088220, 2 , 2 , 0 ,100%,$22 ,$22 
223073,HCF CAT POUCH ROTISSERIE CHKN,4122088221, 192 , 189 , 3 ,98%,$71 ,$70 
223070,HCF CAT POUCH CRAB & TUNA,4122088222, 144 , 138 , 6 ,96%,$53 ,$51 
223124,HCF DOG POUCH GRILLED CHICKEN,4122088672, 72 , 81 ,(9),113%,$36 ,$41 
223119,HCF DOG POUCH GRILLED BEEF,4122088673, 72 , 72 , 0 ,100%,$36 ,$36 
223114,HCF DOG CAN TURKEY & BACON,4122088674, 24 , 24 , 0 ,100%,$12 ,$12 
223092,HCF DOG CAN FILET MIGNON,4122088679, 156 , 151 , 5 ,97%,$150 ,$145 
223091,"HCF DOG CAN TURKEY, RICE & VEG",4122088680, 108 , 108 , 0 ,100%,$104 ,$104 
25128,HCF CAT  - VARIETY JUG,4122090241, 8 , 5 , 3 ,63%,$38 ,$24 
90155,HCF DOG CAN LR/BF/BBC - 12/5.5,4122090802, 34 , 35 ,(1),103%,$203 ,$209 
11956,HEB BARKIN STRIPS BACON/CHS 9P,4122093766, 112 , 114 ,(2),102%,$222 ,$226 
158456,HEB JERKY STIX LEAN,4122093767, 140 , 153 ,(13),109%,$277 ,$303 
844768,HEB HR HEALTHY WEIGHT,4122095848, 12 , 0 , 12 ,0%,$12 ,$0 
787038,HEB HR 95% CHICKEN,4122096313, 12 , 2 , 10 ,17%,$12 ,$2 
669144,HEB HR 95% BEEF & CHICKEN,4122096903, 12 , 1 , 11 ,8%,$12 ,$1 
738614,HEB HR PUPPY CHICKEN RICE,4122096936, 12 , 0 , 12 ,0%,$12 ,$0 
108983,HCF BITE SIZE DRY DOG FOOD,4122097154, 30 , 29 , 1 ,97%,$236 ,$228 
114518,HCF CHEWY CHUNKS & KIBBLE,4122097178, 49 , 51 ,(2),104%,$391 ,$408 
50840,HEB CHOICE CUBES DOG TREATS,4122098143, 130 , 133 ,(3),102%,$257 ,$265 
921419,HEB HR FISH & SWEET POTATO,4122099346, 12 , 0 , 12 ,0%,$12 ,$0 
846450,JONNY CAT LINERS JUMBO BOX,4133400154, 174 , 165 , 9 ,95%,$475 ,$452 
63405,JONNY CAT HVY DTY LINER JUMBO,4133400157, 108 , 116 ,(8),107%,$408 ,$439 
627548,CATS PRIDE BAKING SODA UNSC,4178801325, 52 , 52 , 0 ,100%,$405 ,$405 
180429,CAT'S PRIDE KAT KIT,4178801605, 265 , 251 , 14 ,95%,$795 ,$754 
552639,CATS PRIDE LT WT LTTR SCENTED,4178801942, 34 , 33 , 1 ,97%,$265 ,$257 
559247,CATS PRIDE BAKING SODA SCNT,4178801945, 32 , 33 ,(1),103%,$249 ,$257 
102539,CATS PRIDE TTL ODR CNTRL SCNTD,4178847115, 36 , 31 , 5 ,86%,$251 ,$213 
387852,FRESH STEP CAT LITTER,4460002031, 71 , 69 , 2 ,97%,$567 ,$552 
152924,FR STEP MULTI CAT SCNTD LITTER,4460002049, 108 , 108 , 0 ,100%,"$1,030 ","$1,032 "
23578,FRESH STEP LITTER CRYSTALS,4460003022, 192 , 194 ,(2),101%,"$2,533 ","$2,557 "
129577,FRESH STEP SCOOP CAT LITTER,4460030466, 115 , 117 ,(2),102%,"$1,661 ","$1,691 "
241279,FR STEP MULTI CAT SCENTED LITR,4460030468, 130 , 126 , 4 ,97%,"$1,877 ","$1,824 "
226274,FR STEP EXTREM ODOR CNTRL SCP,4460030623, 143 , 139 , 4 ,97%,"$2,065 ","$2,013 "
101851,FR STEP LTWEIGHT XTRM SCNT LTR,4460031156, 90 , 86 , 4 ,96%,"$1,244 ","$1,197 "
356046,FR STEP MULTI CAT SCNTD LITTER,4460031603, 69 , 64 , 5 ,93%,"$1,178 ","$1,090 "
356070,FR STEP EXTREME ODOR CNTRL LIT,4460031604, 131 , 130 , 1 ,99%,"$2,215 ","$2,194 "
356073,FRESH STEP EXTREME HAWAII LITR,4460031686, 102 , 99 , 3 ,97%,$906 ,$879 
838017,FR STEP CLN PAWS TRIPLE ACTION,4460031874, 101 , 102 ,(1),101%,"$1,346 ","$1,360 "
953335,FANCY FEAST PURELY SLMN CHKN,5000000042, 140 , 132 , 8 ,94%,$157 ,$148 
184150,FNCY FST FLAKED TUNA,5000000124, 480 , 483 ,(3),101%,$307 ,$309 
746166,FANCY FEAST APTZR OCNFSH SHRMP,5000000128, 40 , 34 , 6 ,85%,$35 ,$30 
580007,FANCY FEAST APPTZR SKPJCK TUNA,5000000129, 20 , 27 ,(7),135%,$18 ,$24 
616125,FRISKIES LIL SOUPS SALMON,5000000133, 224 , 222 , 2 ,99%,$211 ,$209 
531174,FRISKIES LIL SOUPS SHRIMP,5000000135, 184 , 189 ,(5),103%,$173 ,$178 
216589,FF APPETIZ TENDER TONGOL TUNA,5000000452, 160 , 147 , 13 ,92%,$179 ,$165 
216571,FF APPETIZER WHITE MEAT CHKN,5000000459, 90 , 87 , 3 ,97%,$101 ,$97 
353891,PURINA BELLA MEAL CHICKN&BACON,5000000485, 96 , 90 , 6 ,94%,$71 ,$67 
10575,PURINA BELLA MEAL FILET MIGNON,5000000486, 108 , 113 ,(5),105%,$80 ,$84 
73876,PURINA BELLA MEAL PRTHSE STEAK,5000000487, 96 , 102 ,(6),106%,$71 ,$75 
353886,PURINA BELLA MEAL TURKEY,5000000491, 72 , 79 ,(7),110%,$53 ,$58 
356863,FRISKIES INDOOR 4X6.3LB,5000001481, 48 , 49 ,(1),102%,$352 ,$357 
714693,FRISKIES SEAFOOD SENSATIONS,5000001547, 148 , 150 ,(2),101%,$583 ,$593 
356866,FRISKIES SEAFOOD SENS 4X6.3,5000001874, 56 , 62 ,(6),111%,$411 ,$455 
22495,FNCY FST GRILLED TURKEY,5000004060, 360 , 358 , 2 ,99%,$230 ,$229 
22497,FNCY FST GRILLED CHICKEN,5000004080, 552 , 555 ,(3),101%,$353 ,$355 
457356,FRISKIES GRLS BLND,5000008450, 112 , 114 ,(2),102%,$441 ,$449 
113735,FNCY FST GRILLED OCN FISH/TUNA,5000010084, 576 , 582 ,(6),101%,$369 ,$373 
113741,FNCY FST GRILLED LIVER&CHK,5000010086, 336 , 380 ,(44),113%,$230 ,$244 
142858,FNCY FST GRILLED SALMON/SHRIMP,5000010206, 600 , 614 ,(14),102%,$384 ,$393 
142859,FNCY FST GRILLED CHICKEN/BEEF,5000010216, 528 , 501 , 27 ,95%,$338 ,$321 
74948,FRISKIES SHREDS W/BEEF,5000010364, 408 , 427 ,(19),105%,$220 ,$231 
142857,FNCY FST GOURMET SALM/SHRIM,5000010386, 864 , 912 ,(48),106%,$553 ,$586 
113709,FRSKS PRIME FILET OCN FSH/TUNA,5000017016, 552 , 537 , 15 ,97%,$298 ,$290 
113707,FRISKIES PRIME FILET CHK & GRY,5000017018, 216 , 214 , 2 ,99%,$117 ,$116 
877665,FANCY FEAST GRMT NTRL OCN FISH,5000017155, 60 , 57 , 3 ,95%,$500 ,$475 
490943,FRISKIES PARTY MIX LOBSTER,5000017179, 90 , 92 ,(2),102%,$135 ,$138 
701999,FRISKIES PARTY MIX CHCKN WAFFL,5000017183, 70 , 77 ,(7),110%,$105 ,$116 
965307,FRISKIES SHREDS 40CT,5000017227, 68 , 68 , 0 ,100%,"$1,393 ","$1,387 "
879033,FANCY FEAST SAVORY CENTER 12CT,5000017298, 20 , 17 , 3 ,85%,$259 ,$220 
22829,FRISKIES MEATY BITS MP,5000019811, 27 , 25 , 2 ,93%,$343 ,$318 
8885,FNCY FST CLSC SEAFOOD MP,5000021562, 18 , 14 , 4 ,78%,$133 ,$105 
661900,FRISKIES PRIME FILET TURKEY,5000022522, 192 , 179 , 13 ,93%,$104 ,$97 
66823,FRISKIES PARTY MIX MIXED GRILL,5000023795, 74 , 68 , 6 ,92%,$111 ,$100 
965894,FANCY FEAST BROTHS CHKN VEG,5000029105, 80 , 83 ,(3),104%,$85 ,$88 
338101,FF BROTHS TUNA ANCHV WHTFISH,5000029109, 192 , 201 ,(9),105%,$204 ,$213 
355165,FANCY FEAST GRVY L0VER PB VP,5000029211, 132 , 129 , 3 ,98%,"$2,434 ","$2,380 "
355163,FANCY FEAST PLTRY BEEF PATE VP,5000029222, 56 , 55 , 1 ,98%,"$1,033 ","$1,018 "
277253,FRISKIES PATE POULTRY FAV,5000029257, 67 , 61 , 6 ,91%,"$1,115 ","$1,007 "
338106,FF BROTHS MACKEREL CRM VEG,5000029342, 128 , 133 ,(5),104%,$136 ,$141 
338098,FF BROTHS SALMON VEGETABLE,5000029365, 208 , 201 , 7 ,97%,$220 ,$213 
95629,FRISKIES PARTY MIX NATURAL CHK,5000029424, 50 , 53 ,(3),106%,$75 ,$80 
815254,PUR FF PARTY MIX NATURALS TUNA,5000029436, 150 , 160 ,(10),107%,$225 ,$240 
749171,FRISKIES TASTY TREASURES CANS,5000029451, 69 , 67 , 2 ,97%,$878 ,$849 
277254,FRISKIES MEATY BITS VP,5000029507, 48 , 46 , 2 ,96%,$308 ,$296 
2619,MGHTY DG ROASTED VP 12/5.5OZ,5000036358, 6 , 6 , 0 ,100%,$47 ,$47 
37794,FNCY FST CHICKEN MP,5000037034, 44 , 44 , 0 ,100%,$655 ,$648 
597609,FRISKIES CLSSC PATE MP,5000042034, 45 , 41 , 4 ,91%,$572 ,$521 
394577,FRISKIES LIVER & CHCKN DINNER,5000042044, 552 , 552 , 0 ,100%,$298 ,$299 
81372,FRISKIES CAT FOOD MIXED GRILL,5000042154, 312 , 316 ,(4),101%,$168 ,$171 
81380,FRISKIES CAT FOOD TURKY/GIBLET,5000042184, 384 , 391 ,(7),102%,$207 ,$211 
9538,FRISKIES MEATY BITS W/BEEF,5000042314, 144 , 159 ,(15),110%,$78 ,$86 
625814,FNCY FST CHUNKY CHICKEN,5000042694, 432 , 389 , 43 ,90%,$276 ,$249 
22012,FNCY FST FLAKED FISH & SHRMP,5000042874, 432 , 416 , 16 ,96%,$276 ,$268 
81067,FNCY FST CLSSC LIVER & CHICKEN,5000042904," 1,008 "," 1,047 ",(39),104%,$645 ,$670 
80994,FNCY FST SEAFOOD CAT FOOD,5000042934, 648 , 725 ,(77),112%,$415 ,$467 
81026,FNCY FST CLSSC SALMON,5000042944, 792 , 725 , 67 ,92%,$507 ,$464 
662163,FNCY FST CLSSC BEEF,5000042954," 1,368 "," 1,340 ", 28 ,98%,$876 ,$858 
80879,FNCY FST CLSSC OCEAN FISH/TUNA,5000042964, 480 , 492 ,(12),103%,$307 ,$315 
377812,FRISKIES SHREDS CHICKEN/SALMON,5000044569, 600 , 573 , 27 ,96%,$324 ,$310 
158752,FRISKIES CL PATE FSH MP,5000045435, 64 , 59 , 5 ,92%,"$1,065 ",$979 
357056,FANCY FEAST DRY CHCKN & TRKY,5000046300, 88 , 91 ,(3),103%,$649 ,$672 
356854,FRISKIES FLAKED TUNA & EGG,5000048024, 384 , 376 , 8 ,98%,$207 ,$203 
605458,FANCY FEAST GRMT NATS 12CT,5000050032, 38 , 33 , 5 ,87%,$367 ,$323 
846534,FANCY FEAST GOURM NATS 12CT,5000050035, 40 , 33 , 7 ,83%,$379 ,$317 
799088,FRISKIES PARTY MIX BEACH 30OZ,5000050037, 27 , 24 , 3 ,89%,$316 ,$282 
923492,FRISKIES PARTY MIX ORIG 30OZ,5000050041, 33 , 31 , 2 ,94%,$386 ,$364 
616770,FRISKIES PARTY MIX CHICKN 30OZ,5000050045, 30 , 19 , 11 ,63%,$351 ,$222 
34914,FNCY FST GRILLED SALMON,5000050389, 504 , 483 , 21 ,96%,$323 ,$309 
419597,FANCY FEAST SEAFOOD VP 36CT,5000051420, 28 , 23 , 5 ,82%,$616 ,$506 
154257,FF ELG MDLY SALMON FLORENTINE,5000057049, 672 , 666 , 6 ,99%,$564 ,$560 
158742,FRISKIES SHREDS W/CHICKEN,5000057198, 480 , 493 ,(13),103%,$259 ,$267 
158743,FRISKIES SHREDS W/SALMON,5000057201, 576 , 600 ,(24),104%,$311 ,$324 
158800,MGHTY DOG SEL MENU VP 12/5.5OZ,5000057211, 12 , 14 ,(2),117%,$94 ,$110 
158729,FNCY FST GRILLED BEEF & LIVER,5000057225, 552 , 512 , 40 ,93%,$353 ,$328 
139519,FF ELG MDLY FLRNTNE VP,5000057281, 180 , 181 ,(1),101%,"$1,793 ","$1,807 "
357066,FF GOURMET GOLD FILET MIGNON,5000057283, 140 , 134 , 6 ,96%,"$1,033 ",$989 
179731,FRISKIES PARTY MIX BEACHSIDE,5000057443, 84 , 88 ,(4),105%,$126 ,$132 
19007,FF ELG MDLY CHICKEN PRIMAVERA,5000057458, 696 , 690 , 6 ,99%,$585 ,$580 
79562,FF ELG MDLY SALMON PRIMAVERA,5000057490, 648 , 683 ,(35),105%,$544 ,$574 
133935,FRISKIES GRILLERS BLEND,5000057578, 19 , 20 ,(1),105%,$224 ,$236 
133932,FRISKIES SURF & TURF FAVORITES,5000057579, 31 , 28 , 3 ,90%,$365 ,$330 
261656,FRISKIES TASTY TREAS CHKN TUNA,5000057795, 240 , 225 , 15 ,94%,$130 ,$122 
208182,FRISKIES TREASURE CHKN GRVY LV,5000057796, 144 , 128 , 16 ,89%,$78 ,$69 
261655,FRISKIES TASTY TREAS OCEANFISH,5000057797, 504 , 487 , 17 ,97%,$272 ,$263 
208183,FRISKIES TREASURES TURK & CHSE,5000057798, 168 , 153 , 15 ,91%,$91 ,$83 
277257,FRISKIES PRIME FILETS MF,5000057800, 60 , 59 , 1 ,98%,$763 ,$744 
203243,FANCY FEAST GRAVY OCEAN WHTFSH,5000057843, 576 , 552 , 24 ,96%,$369 ,$353 
203246,FANCY FEAST GRAVY LOVERS CHKN,5000057845," 1,416 "," 1,364 ", 52 ,96%,$906 ,$874 
261658,FANCY FEAST GRAVY LOVERS BEEF,5000057847, 576 , 559 , 17 ,97%,$369 ,$358 
208181,FRISKIES SAVORY SHREDS,5000057919, 72 , 67 , 5 ,93%,$916 ,$856 
208180,FANCY FEAST CHEDDAR LOVERS TNA,5000057928, 312 , 321 ,(9),103%,$200 ,$205 
208179,FANCY FEAST CHEDDAR CHKN,5000057931, 624 , 655 ,(31),105%,$399 ,$419 
208178,FANCY FEAST CHEDDAR LOVE TURK,5000057933, 480 , 475 , 5 ,99%,$307 ,$304 
126129,FRISKIES TASTY TREASURES,5000057963, 72 , 74 ,(2),103%,$462 ,$475 
3948,FRISKIES SAVSHRD WTFSH SRN,5000057990, 960 , 973 ,(13),101%,$518 ,$526 
3128,FANCY FEAST GRAVYLOVERS TURKEY,5000058004, 936 , 969 ,(33),104%,$614 ,$620 
165502,ALPO COME N GET IT,5000058090, 26 , 24 , 2 ,92%,$194 ,$179 
355173,FANCY FEAST PTRY BF GRLL VP,5000058566, 96 , 98 ,(2),102%,"$1,770 ","$1,808 "
277261,FANCY FEAST SEAFOOD CLS VP,5000058568, 56 , 60 ,(4),107%,"$1,033 ","$1,110 "
163684,FRISKIES PARTY MIX MEOW LUAU,5000058598, 80 , 79 , 1 ,99%,$120 ,$119 
355172,FANCY FST SEAFD GRILLD VP,5000058664, 122 , 123 ,(1),101%,"$2,250 ","$2,262 "
34915,FNCY FST GRILLED TUNA,5000083612, 840 , 835 , 5 ,99%,$538 ,$535 
23979,FRISKIES TREASURES CHK TN BAC,5000096004, 72 , 71 , 1 ,99%,$39 ,$38 
28838,FRISKIES TREASURES TRK BACON,5000096006, 144 , 94 , 50 ,65%,$78 ,$51 
30610,FRISKIES TREASURES CHK BACON,5000096016, 96 , 65 , 31 ,68%,$52 ,$35 
45353,FANCY FEAST BROTH CLASSIC COLL,5000096042, 39 , 37 , 2 ,95%,$473 ,$448 
45520,FANCY FEAST BROTHS CREAMY COLL,5000096049, 30 , 31 ,(1),103%,$364 ,$376 
314112,FRISKIES CAT CONCOCTIONS CHKN,5000096282, 120 , 150 ,(30),125%,$65 ,$81 
314037,FRISKIES PRTY MIX CR KAHUNA,5000096304, 90 , 91 ,(1),101%,$717 ,$726 
314034,FRISKIES PRTY MIX TR ISL 20 OZ,5000096306, 33 , 35 ,(2),106%,$263 ,$279 
314028,FRISKIES PARTY MIX CR ORIGINAL,5000096308, 87 , 81 , 6 ,93%,$693 ,$648 
314032,FRISKIES PARTY MIX CR BEACHSID,5000096310, 72 , 69 , 3 ,96%,$574 ,$551 
312807,PEDIGREE DENTASTIX ORIG LARGE,5849604347, 92 , 90 , 2 ,98%,$964 ,$945 
129565,TEMPTATIONS SEAFOOD MEDLEY FLV,5849628128, 130 , 130 , 0 ,100%,$408 ,$408 
102381,TEMPTATIONS TANTALIZING TURKEY,5849670123, 96 , 99 ,(3),103%,$144 ,$149 
158859,WHISKA CAT MILK PLUS,5849671226, 56 , 62 ,(6),111%,$145 ,$161 
88438,TEMPTATIONS TASTY CHICKEN FLAV,5849672300, 200 , 196 , 4 ,98%,$628 ,$616 
88649,TEMPTATIONS SAVORY SALMON FLAV,5849672301, 100 , 92 , 8 ,92%,$345 ,$289 
